<?xml version="1.0" encoding="UTF-8"?>
<!DOCTYPE Automatas SYSTEM "autoDS.dtd" >
<Automatas><NFA name="Example">
		<States>
			<state>p</state>
			<state>q</state>
			<state>r</state>
		</States>
		<InputSymbols>
			<symbol>a</symbol>
			<symbol>b</symbol>
			<symbol>c</symbol>
		</InputSymbols>
		<TranFuncs>
			<Tranfunc>
				<state>p</state>
				<symbol>^</symbol>
				<state>q</state>
			</Tranfunc>
			<Tranfunc>
				<state>p</state>
				<symbol>^</symbol>
				<state>r</state>
			</Tranfunc>
			<Tranfunc>
				<state>p</state>
				<symbol>b</symbol>
				<state>q</state>
			</Tranfunc>
			<Tranfunc>
				<state>p</state>
				<symbol>c</symbol>
				<state>r</state>
			</Tranfunc>
			<Tranfunc>
				<state>q</state>
				<symbol>a</symbol>
				<state>p</state>
			</Tranfunc>
			<Tranfunc>
				<state>q</state>
				<symbol>b</symbol>
				<state>r</state>
			</Tranfunc>
			<Tranfunc>
				<state>q</state>
				<symbol>c</symbol>
				<state>p</state>
			</Tranfunc>
			<Tranfunc>
				<state>q</state>
				<symbol>c</symbol>
				<state>q</state>
			</Tranfunc></TranFuncs>
		<StartQ>
			<state>p</state>
		</StartQ>
		<FinalStates>
			<state>r</state>
		</FinalStates>
	</NFA>
</Automatas>
