<?xml version="1.0" encoding="UTF-8" standalone="no"?><!DOCTYPE Automatas SYSTEM "autoDS.dtd"><Automatas><NFA name=""><States><state>q6</state><state>q5</state><state>q7</state><state>q2</state><state>q1</state><state>q4</state><state>q3</state></States><InputSymbols><symbol>b</symbol><symbol>a</symbol></InputSymbols><TranFuncs><Tranfunc><state>q1</state><symbol>^</symbol><state>q2</state></Tranfunc><Tranfunc><state>q1</state><symbol>^</symbol><state>q4</state></Tranfunc><Tranfunc><state>q2</state><symbol>^</symbol><state>q3</state></Tranfunc><Tranfunc><state>q3</state><symbol>^</symbol><state>q6</state></Tranfunc><Tranfunc><state>q5</state><symbol>^</symbol><state>q7</state></Tranfunc><Tranfunc><state>q6</state><symbol>^</symbol><state>q1</state></Tranfunc><Tranfunc><state>q4</state><symbol>a</symbol><state>q5</state></Tranfunc><Tranfunc><state>q5</state><symbol>b</symbol><state>q6</state></Tranfunc></TranFuncs><StartQ><state>q1</state></StartQ><FinalStates><state>q7</state><state>q6</state></FinalStates></NFA></Automatas>