<?xml version="1.0" encoding="UTF-8"?>
<!DOCTYPE Automatas SYSTEM "autoDS.dtd" >
<Automatas><NFA>
		<States>
			<state>p</state>
			<state>q</state>
			<state>r</state>
			<state>s</state>
		</States>
		<InputSymbols>
			<symbol>0</symbol>
			<symbol>1</symbol></InputSymbols>
		<TranFuncs>
			<Tranfunc>
				<state>p</state>
				<symbol>1</symbol>
				<state>q</state>
			</Tranfunc>
			<Tranfunc>
				<state>p</state>
				<symbol>0</symbol>
				<state>q</state>
			</Tranfunc>
			<Tranfunc>
				<state>p</state>
				<symbol>0</symbol>
				<state>s</state>
			</Tranfunc>
			<Tranfunc>
				<state>q</state>
				<symbol>0</symbol>
				<state>r</state>
			</Tranfunc>
			<Tranfunc>
				<state>q</state>
				<symbol>1</symbol>
				<state>r</state>
			</Tranfunc>
			<Tranfunc>
				<state>q</state>
				<symbol>1</symbol>
				<state>q</state>
			</Tranfunc>
			<Tranfunc>
				<state>r</state>
				<symbol>0</symbol>
				<state>s</state>
			</Tranfunc>
			<Tranfunc>
				<state>r</state>
				<symbol>1</symbol>
				<state>p</state>
			</Tranfunc>
			<Tranfunc>
				<state>s</state>
				<symbol>1</symbol>
				<state>p</state>
			</Tranfunc></TranFuncs>
		<StartQ>
			<state>p</state>
		</StartQ>
		<FinalStates>
			<state>q</state>
			<state>s</state>
		</FinalStates>
	</NFA>
</Automatas>
